id,image_path,label,text,reason
401,hatred_401.png,1,When you get to choose your own mental illness,Mocking the LGBT community and gender identity choice by comparing it to mental illness to invalidate it.
402,hatred_402.png,1,Sharks don't attack him why? they think it's whale shit,Comparing black people to whale shit to dehumanize and mock them with a derogatory metaphor.
403,hatred_403.png,1,A group of men,"Mocking men by comparing a group of dogs to them, implying hostility and dehumanization of males."
404,hatred_404.png,1,Kill one half of,"Mocking Elon Musk's Twitter layoffs by comparing it to Thanos wiping out half the universe, showing employees fading."
405,hatred_405.png,1,Haven't heard you're not halal?,"Dehumanizing Muslims by depicting a Muslim character with a bomb, associating their religion with terrorism and threats."
406,hatred_406.png,0,"This is my friend, we support each other",A positive depiction of diverse friendships without any hateful metaphors or derogatory text.
