id,image_path,label,text,reason
1235,01235.png,1,,disrespects the muslims by insinuating that they are into bestiality.
1247,01247.png,1,,mocks the jews by downplaying the culling of the jews by hitler during the holocaust.
1258,01258.png,1,,disrespects the males by implying that they are faggots if they are offended easily.
1269,01269.png,1,,mocks the muslims for being haram.
1295,01295.png,1,,mocks the christians by labelling them as child molesters.
1349,01349.png,1,,disrespects the jews by downplaying the culling of jews by hitler.
1395,01395.png,1,,mocks the mexicans for the skin colour and implying that they are birthed from the anus.
1436,01436.png,1,,disrespects the people with intellectual disabilities by joking about how their disability can make them impervious to bullets.
1467,01467.png,1,,disrespects the whites by expressing animosity against them via the derogatory term honky.
1469,01469.png,1,,disrespects the muslims by labelling them as suicide bombers and expressing hate against them.
1475,01475.png,1,,disrespects the muslims by suggesting they be killed of like what vlad the impaler did.
1487,01487.png,1,,mocks the people with intellectual disabilities.
1497,01497.png,1,,mocks the muslims for their practice of child marriages.
1546,01546.png,1,,disrespects the jews by expressing animosity against them and suggesting that they be killed off.
1568,01568.png,1,,disrespects the muslims by suggesting that they are terrorists and have infiltrated the government by taking up government positions.
1578,01578.png,1,,dehumanizes the blacks by likening them to monkeys.
1579,01579.png,1,,disrespects the muslims by celebrating the departure of muslims owing to the lack of pork-free food.
1589,01589.png,1,,disrespects the lgbt community by joking about their sexual practices.
1642,01642.png,1,,disrespects the blacks by suggesting that the blacks are lesser people who are unable to read.
1643,01643.png,1,,mocks the blacks by likening their skin colour to a shadow.
1649,01649.png,1,,disrespects the blacks by suggesting that they are murderers and should be incarcerated.
1682,01682.png,1,,disrespects the muslims by expressing animosity against them and labelling them as child rapists.
1793,01793.png,1,,disrespects the muslims by likening the burning of muslims to the watering of plants.
1924,01924.png,1,,disparages the females by implying that they are lesser beings that can't even function like a suicide vest when triggered.
1943,01943.png,1,,disrespects the people with physical disabilities by joking about their vision impairment and how that would cause them to fail in wooing.
1953,01953.png,1,,disparages the muslims by suggesting they be hunted and killed off.
1975,01975.png,1,,disrespects the muslims by insinuating that they are into bestiality.
2158,02158.png,1,,disrespects the females by suggesting that they are lesser beings through likening them to chickens.
2165,02165.png,1,,mocks the muslims by insinuating them to be killers if one does not abide by allah.
2169,02169.png,1,,mocks the asians for their small eyes and having to open them bigger to see better.
2317,02317.png,1,,disparages the whites by expressing animosity against them and suggesting they go to hell.
2351,02351.png,1,,disrespects the people with intellectual disabilities by suggesting that people would not approach the them.
2358,02358.png,1,,disrespects the jews by downplaying the culling of the jews during the holocaust through the labelling anne frank as one of the wimpy kids subjected the aforementioned culling.
2371,02371.png,1,,disrespects the mexicans by mocking their looks.
2381,02381.png,1,,dehumanizes the blacks by suggesting that they belong in the jail.
2389,02389.png,1,,disrespects the jews by defending an offence remark made by ilhan omar against the jews.
2431,02431.png,1,,disrespects the females by implying they are lesser people who are only good for preparing food for someone else.
2435,02435.png,1,,disrespects the people with physical disabilities by mocking their small stature and suggesting that they are as easy to spin as a fidget spinner.
2457,02457.png,1,,disrespects the blacks through the use of the kkk which is a white supremacist terrorist and hate group.
2481,02481.png,1,,disparages the lgbt community by expressing animosity against them and suggesting that they should die.
2561,02561.png,1,,dehumanizes the mexicans by suggesting that they are savages and will force their way into america and reap havoc.
2581,02581.png,1,,mocks the males for being rapists and suggesting that they be killed.
2594,02594.png,1,,disrespects the muslims by insinuating them to be into bestiality.
2653,02653.png,1,,disrespects the muslims by suggesting that they are child rapists who get away scot-free.
2657,02657.png,1,,dehumanizes the females by implying that they are lesser people who are only good for making sandwiches.
2674,02674.png,1,,mocks the asians for their poor driving skills by suggesting that they would crash the car.
2719,02719.png,1,,disrespects the blacks by likening them to monkeys.
2768,02768.png,1,,disrespects the immigrants by looking down on their livelihood.
2814,02814.png,1,,disrespects the people with intellectual disabilities through the use of a pun on down syndrome.
2815,02815.png,1,,disparages the blacks by expressing animosity towards them and suggesting they be beaten and segregated from the whites.
2816,02816.png,1,,disrespects the people with intellectual disabilities by joking about them drowning through a pun.
2831,02831.png,1,,disparages the refugees by implying that they should be attacked by sharks along their journey seeking refuge.
2849,02849.png,1,,disrespects the asians by mocking their english pronounciation.
2853,02853.png,1,,disrespects the muslims by taking their teachings out of context and suggesting that it can radicalise them.
2854,02854.png,1,,disrespects the people with physical disabilities by making fun of their small stature.
2857,02857.png,1,,disrespects the females by downplaying their education and implying that they are lesser people.
2863,02863.png,1,,disrespects the whites by implying that they are a threat to people.
2876,02876.png,1,,disrespects the people with intellectual disabilities by joking about their disposition towards milkshake.
2891,02891.png,1,,disrespects the muslims by suggesting that they are suicide bombers.
2917,02917.png,1,,disparages the muslims by expressing animosity against them through pointing a gun at them.
2945,02945.png,1,,mocks the indians by downplaying their hunger situation during the british empire.
2946,02946.png,1,,disrespects the jews by downplaying the culling of the jews through a pun on anne frank being hot.
2965,02965.png,1,,disrespects the people with physical disabilities by mocking their vision impairment and joking about dumping them as they look like they are looking at someone else.
2967,02967.png,1,,disrespects the blacks by portraying a white politician holding a bill which is about to be passed to repress black people rights.
2971,02971.png,1,,disrespects the people with intellectual disabilities by making fun of harvey price being close to his mother.
2974,02974.png,1,,mocks the the people with physical disabilities and implying that they are only good for sexual gratification.
3124,03124.png,1,,disrespects the muslims by suggesting that they are terrorists who craft bombs.
3128,03128.png,1,,mocks the blacks by suggesting that they are thieves.
3145,03145.png,1,,disrespects the lgbt community by suggesting that each group is mentally challenged.
3148,03148.png,1,,disrespects the africans by mocking their lack of food.
3178,03178.png,1,,disrespects the muslims by suggesting that they all all terrorists and are related to the 9/11 attacks.
3185,03185.png,1,,mocks the africans for their lack of food and that they would go so far to eat semen.
3254,03254.png,1,,dehumanizes the blacks by suggesting that they are prone to gun violence.
3257,03257.png,1,,dehumanizes the whites as poor marriage partners.
3258,03258.png,1,,disrespects the refugees by suggesting they are seeking asylum in australia for steroids.
3291,03291.png,1,,vilifies the muslims by suggesting that they should not be allowed to immigrate to australia.
3421,03421.png,1,,mocks the whites for the white shooting incidents that happened in schools.
3472,03472.png,1,,disrespects the blacks by likening them to animals who are put for sale.
3479,03479.png,1,,disparages the blacks by likening them to dirt.
3591,03591.png,1,,derides the females in governments whom systemically exploit the blacks under the pretense that they are helping them.
3756,03756.png,1,,mocks the blacks by highlighting the irony of blacks living all over europe when they are the comes harassing white people for living in africa.
3764,03764.png,1,,disrespects the muslims by labelling them as terrorists.
3789,03789.png,1,,disrespects the jews by downplaying the culling of jews by hitler through the incorporation of a pun on anne frank.
3794,03794.png,1,,derides the lgbt community by mocking their eyebrows.
3841,03841.png,1,,mocks the people with physical disabilities who have terminal illnesses by joking about their short lifespan.
3845,03845.png,1,,disrespects the blacks by likening them to gorillas.
3854,03854.png,1,,dehumanizes the jews by implying that they are lesser than animals.
3864,03864.png,1,,dehumanizes the americans as school shooters.
3874,03874.png,1,,dehumanizes the refugees by suggesting that they are drug traffickers.
3896,03896.png,1,,disrespects the jews by celebrating the culling of the jews by hitler.
3927,03927.png,1,,disrespects the muslims by insinuating them to be into bestiality.
3947,03947.png,1,,disrespects the people with physical disabilities by joking about stephen hawking's posture.
4126,04126.png,1,,dehumanizes the jews by suggesting that they are lesser people who will not end up in heaven.
4138,04138.png,1,,disparages the blacks by likening them to bicycles and suggesting that they should be enslaved else they will not work.
4163,04163.png,1,,disrespects the whites by expressing animosity against them.
4175,04175.png,1,,disparages the blacks as criminals.
4263,04263.png,1,,disrespects the jews by downplaying the culling of the jews during the holocaust by incorporating ii into a pun on anne frank.
4267,04267.png,1,,mocks the muslims by suggesting that they are the culprits to any incident.
4268,04268.png,1,,disrespects the muslims by suggesting that they are anything but normal people.
4287,04287.png,1,,ridicules the females as less capable humans by suggesting that their only job is to cook for their husbands.
4326,04326.png,1,,ridicules the asians as primitive by suggesting that they eat cats.
4328,04328.png,1,,ridicules the middle easts as inferior by likening them to dog excrement.
4356,04356.png,1,,disrespects the blacks by trivializing the enslavement of the blacks on cotton fields.
4361,04361.png,1,,dehumanizes the muslims as inferior by suggesting that every muslim country is backward.
4397,04397.png,1,,disrespects the jews by making a pun on the word 'auschwitz' to trivialize the internment of jews at auschwitz during the holocaust.
4529,04529.png,1,,disrespects the muslims by encouraging the propagation of the images of pigs which upset the muslims.
4579,04579.png,1,,disrespects the catholic christians by suggesting that they protect paedophiles.
4619,04619.png,1,,ridicules the whites as trash by suggesting that barbie is a bad influence on children.
4623,04623.png,1,,ridicules the mexicans as overweight by suggesting that they receive large amounts of money in food stamps from the us government.
4658,04658.png,1,,dehumanizes the muslims as cold-blooded killers by suggesting that the muslims will even kill people who sympathize with them.
4765,04765.png,1,,disrespects the muslims by trivializing the invasion of afghanistan by the us in 2001.
4786,04786.png,1,,ridicules members of the lgbt community by likening their gender identity to a mental illness.
4791,04791.png,1,,ridicules the muslims as sex maniacs by suggesting that there is no dress that can provide women security from muslim males.
4813,04813.png,1,,ridicules the blacks as thieves by suggesting that thievery is their way of life and that not engaging in thievery can turn them into superior whites.
4819,04819.png,1,,disrespects the jews by trivializing the killing of jews in gas chambers in auschwitz during the holocaust.
4827,04827.png,1,,ridicules the americans by mocking the vietnam war veterans for being reminded of gunshots when they hear popcorn kernels popping in the microwave.
4859,04859.png,1,,disrespects the blacks by using wordplay to call them niggers.
4873,04873.png,1,,derides the lgbt community by mocking caitlyn jenner for being a transgender.
4912,04912.png,1,,ridicules the mexicans as invaders for waving the mexican flag.
4918,04918.png,1,,ridicules the asians as blind by mocking the appearance of their eyes.
4928,04928.png,1,,dehumanizes the females as less capable humans that are not good for anything except dishwashing.
5123,05123.png,1,,ridicules the blacks as thieves by suggesting that are usually responsible for thefts in the neighbourhood.
5127,05127.png,1,,dehumanizes the muslims as murderers by suggesting that they will kill you for trivial reasons.
5148,05148.png,1,,disrespects the japanese by trivializing the dropping of two atomic bombs on hiroshima and nagasaki before japan surrendered in world war 2.
5164,05164.png,1,,disrespects the africans by mocking their lack of access to food.
5172,05172.png,1,,dehumanizes the muslims as murderers by suggesting that they will kill anyone who doesn't agree that islam is the religion of peace.
5241,05241.png,1,,ridicules the blacks as inferior by suggesting that their black skin colour is a disadvantage and that vitiligo can help them get rid of their blackness.
5264,05264.png,1,,derides the people of color as the problem.
5273,05273.png,1,,ridicules the females as whores by suggesting that they engage in sexual intercourse with multiple males.
5297,05297.png,1,,ridicules the females by suggesting that their only job is to handle household chores.
5329,05329.png,1,,ridicules the blacks as inferior by suggesting that being coloured is a bad thing.
5398,05398.png,1,,ridicules the whites as racists by suggesting that they target only the blacks.
5471,05471.png,1,,ridicules the lgbt community for their sexual preferences by calling homosexuals faggots.
5614,05614.png,1,,ridicules the blacks as inferior by likening them to bear shit.
5643,05643.png,1,,disrespects the africans by suggesting that the hungry african children should eat the flies hovering over their bodies to avoid starving.
5719,05719.png,1,,ridicules the muslims as abusive by suggesting that they beat their wives.
5736,05736.png,1,,dehumanizes the jews as inhumane by suggesting that they do not teach their children about humanity.
5749,05749.png,1,,ridicules the muslims as dangerous by calling them explosive.
5782,05782.png,1,,uses derogatory terms against the blacks by calling them niggers.
5784,05784.png,1,,ridicules the blacks as primitive by suggesting that their children look like gorillas.
5826,05826.png,1,,ridicules the females as intellectually inferior by suggesting that females are always wrong.
5872,05872.png,1,,ridicules the muslims as destructive by suggesting that they cause destruction wherever they go.
5917,05917.png,1,,ridicules the people with physical disabilities (stephen hawking) by likening them to a damaged chair.
5926,05926.png,1,,dehumanizes the muslims as terrorists by suggesting that the muslims plan bombings.
5941,05941.png,1,,dehumanizes the africans as sticky strips by calling the dying bodies of starving african children sticky.
5942,05942.png,1,,ridicules the muslims as unsuitable partners by suggesting that the cause of princess diana's death was her relationship with a muslim man.
5943,05943.png,1,,excludes the whites by likening them to trash and suggesting that they should be taken out.
5987,05987.png,1,,ridicules the blacks as primitive by suggesting that dating a black is similar to having an ape for a pet.
6179,06179.png,1,,ridicules the muslims as degenerates by suggesting that muslim males engage in sexual intercourse with goats.
6213,06213.png,1,,disrespects the lgbt community by suggesting that the only people having sexual intercourse with transgenders are those from the us navy.
6293,06293.png,1,,instigates violence against members of the lgbt community by suggesting that transgenders should be killed to end transphobia.
6315,06315.png,1,,instigates violence against the mexicans by suggesting that their dead bodies should be left hanging at the us-mexico border.
6349,06349.png,1,,ridicules the muslims as inferior by suggesting that they are unfit to be voted into the us government.
6374,06374.png,1,,disrespects the muslims by mocking the execution of benito mussolini who was known as the 'protector of islam.
6378,06378.png,1,,ridicules the blacks as primitive by likening them to apes.
6415,06415.png,1,,ridicules the whites as unsuitable partners by suggesting that dating white men is disgusting.
6435,06435.png,1,,disrespects the blacks by trivializing the trade of black slaves for cotton picking during the colonial times in the us.
6471,06471.png,1,,ridicules the whites as evil by suggesting that they oppress the blacks.
6479,06479.png,1,,instigates violence against the blacks by suggesting that one should shoot blacks as a white cop.
6482,06482.png,1,,ridicules the females as inferiors by suggesting that their only job is to make sandwiches for their husbands.
6483,06483.png,1,,"ridicules the females as irritating by suggesting that they perpetually whine, nag and bitch."
6489,06489.png,1,,uses derogatory terms towards the muslims to call them less intelligent by comparing their hijab with diapers and calling them having shit for brain.
6519,06519.png,1,,ridicules the muslims as goat fuckers by suggesting that muslim males engage in sexual intercourse with goats.
6534,06534.png,1,,ridicules the blacks as abusive by suggesting that they beat up their girlfriends.
6541,06541.png,1,,disrespects the jews by trivializing the killing of jews in gas chambers during the holocaust.
6543,06543.png,1,,"ridicules the blacks as inferior by suggesting that despite all their good qualities, they'll always remain inferior due to their colour."
6547,06547.png,1,,disrespects the jews by trivializing the jews' struggle to hide from the germans during the holocaust.
6584,06584.png,1,,ridicules the lgbt community by suggesting that one can become transgender by consuming too much trans fat.
6589,06589.png,1,,ridicules the muslims as goat fuckers by suggesting that muslim males engage in sexual intercourse with goats.
6759,06759.png,1,,ridicules the people with intellectual disabilities by mocking the way they eat ice cream for the first time.
6781,06781.png,1,,ridicules the blacks as dangerous by suggesting that they must be subdued using bullets instead of normal methods.
6795,06795.png,1,,dehumanizes the muslims as abusive by suggesting that muslim males abuse their wives.
6823,06823.png,1,,disrespects the jews by trivializing the killing of jews in gas chambers during the holocaust.
6824,06824.png,1,,uses derogatory terms against members of the lgbt community.
6825,06825.png,1,,ridicules the muslims as abusive by suggesting that muslim males use force as a means of persuade their wives.
6832,06832.png,1,,excludes the muslims by promoting of an australian who removes muslims.
6845,06845.png,1,,dehumanizes the muslims as goat shaggers by suggesting that the muslim males engage in sexual intercourse with goats.
6859,06859.png,1,,ridicules the germans as mass murderers by mocking the role of a german (hitler) in the mass murder of the jews during the holocaust.
6871,06871.png,1,,ridicules the muslims as degenerates by suggesting that muslim males engage in sexual intercourse with goats.
6873,06873.png,1,,dehumanizes the muslims as degenerates by suggesting that they create and view goat porn.
6874,06874.png,1,,disrespects the jews by trivializing the killings of jews by germans in gas chambers during the holocaust.
6893,06893.png,1,,disrespects the females by trivializing rape and abortion.
6897,06897.png,1,,ridicules the blacks as slaves of the whites by suggesting that they are still subject to oppression by the whites.
6914,06914.png,1,,ridicules the muslims as untrustworthy by using the 9/11 attacks as a reason to not vote them into the us government.
6934,06934.png,1,,disrespects the jews by trivializing hitler's killing of jews during the holocaust.
6937,06937.png,1,,dehumanizes the muslims as degenerates by calling their religion sick and likening them to zombies.
6987,06987.png,1,,disrespects the females by mocking female addicts who do not have custody of their children due to their addiction.
7125,07125.png,1,,dehumanizes the muslims as terrorists by suggesting that the us should be wary of muslims being voted to congress after the 9/11 attacks.
7159,07159.png,1,,instigates violence against the females by suggesting that the shooter should engage in sexual intercourse with the dead female's body.
7192,07192.png,1,,disrespects the jews by trivializing the capture and internment of jewish families in concentration camps during the holocaust.
7236,07236.png,1,,disrespects the blacks by using wordplay to form the word 'nigger.
7254,07254.png,1,,instigates violence against the muslims by encouraging women to shoot muslims.
7261,07261.png,1,,disrespects the americans by calling the american gypsies trash.
7293,07293.png,1,,disrespects the whites by trivializing the experiences of those who jumped from the world trade center building during the 9/11 attacks.
7294,07294.png,1,,disrespects the jews by suggesting that the axis powers should have won world war 2 to prevent the jews from living in germany.
7356,07356.png,1,,ridicules the females as less capable humans by suggesting that their only job is to cook for their husbands.
7385,07385.png,1,,disrespects the jews by trivializing the killing of jews in gas chambers during the holocaust.
7412,07412.png,1,,ridicules the whites by likening them to trash.
7419,07419.png,1,,incites violence against the blacks by threatening to shoot them if they arrive.
7452,07452.png,1,,disrespects the jews by denying the existence of the gas chambers that were used to kill many jews.
7456,07456.png,1,,mocks the muslims as abusive to women in relationships.
7458,07458.png,1,,attacks the lgbt community for being so evil that even satan is not amused.
7465,07465.png,1,,incites hate and violence towards the blacks if they do not return the god of white people.
7486,07486.png,1,,ridicules the lgbt community by suggesting lesbians are unnatural as they have both characteristics of males and females.
7561,07561.png,1,,incites violence against the jews to break their windows and property.
7592,07592.png,1,,uses derogatory terms against the lgbt community and suggesting they get mad easily.
7628,07628.png,1,,stereotypes the muslims as plane terrorists.
7651,07651.png,1,,dehumanizes the females as the lesser gender that deserve to get beaten up for talking back to men and having a smart mouth.
7685,07685.png,1,,mocks the people with intellectual disabilities by downplaying suicidal thoughts and encouraging suicide.
7692,07692.png,1,,dehumanizes the blacks as less capable humans that are to be kept as slaves.
7693,07693.png,1,,mocks the muslims by suggesting they are into bestiality and date goats.
7849,07849.png,1,,dehumanizes the blacks as inferior to whites as they abuse their relationship partners.
7853,07853.png,1,,ridicules the lgbt community by labelling them as a bigger tragedy than the 9/11 attacks.
7865,07865.png,1,,dehumanizes the females as less capable humans that are only good for household chores such as dishwashing as well as fulfilling the sexual needs of men.
7931,07931.png,1,,incites violence aginst the blacks unless they become christians.
7956,07956.png,1,,mocks the blacks by comparing them to chewbacca who is a harry looking beast.
7965,07965.png,1,,dehumanizes the blacks as less capable humans that cannot prosper without whites.
7968,07968.png,1,,mocks the blacks for not having fathers as children.
7984,07984.png,1,,derides the muslims by labelling them as intolerables.
8125,08125.png,1,,uses derogatory terms against the lgbt community and suggesting they have been rebuilt over something natural.
8146,08146.png,1,,incites violence and hate against the females.
8163,08163.png,1,,uses derogatory terms against the lgbt community in a joke about pushing them off a balcony to paralyse them.
8164,08164.png,1,,ridicules the muslims for their religious hijab by likening it to a diaper.
8173,08173.png,1,,mocks the muslims as jew-hating islamists.
8176,08176.png,1,,uses derogatory terms against the blacks to compare them to shit stains.
8219,08219.png,1,,ridicules the lgbt community by labelling gays as unnatural and unintended by god.
8234,08234.png,1,,ridicules the lgbt community by using them as a slur.
8251,08251.png,1,,uses derogatory terms against the people with intellectual disabilities.
8267,08267.png,1,,mocks the whites by insinuating they engage in all sorts of incestuous relationships in the family.
8275,08275.png,1,,incites violence against the females by suggesting they should be taught with violence.
8317,08317.png,1,,mocks the muslims by ridiculing their religious headwear as diapers and insulting them as having shit for brains.
8349,08349.png,1,,incites violence against the muslims by stating it would be an honor to kill all the muslims.
8375,08375.png,1,,mocks the muslims as terrorists that have a suicide bomb vest as a traditional garb.
8395,08395.png,1,,mocks the blacks for having fathers that would disappear at their child's birth.
