id,image_path,label,text,reason
68913,68913.png,1,,insults the blacks by suggesting black women are not women by saying suggesting that michelle obama is not a woman.
68917,68917.png,1,,insults the blacks by suggesting that they do not work.
68943,68943.png,1,,insults the blacks by trivializing racism against the blacks by suggesting its okay to be racist if you know a black person.
68950,68950.png,1,,vilifies the muslims by suggesting that they are terrorists who blow things up.
68973,68973.png,1,,vilifies the christians by suggesting that they are suicide bombers.
68975,68975.png,1,,insults the blacks by suggesting that black people are dangerous.
69014,69014.png,1,,insults the blacks by making fun of the assassination of martin luther king jr. by james earl ray with a remington rifle.
69025,69025.png,1,,objectify the females by calling them dishwashers.
69057,69057.png,1,,vilifies the muslims by suggesting that they are terrorists who blow things up.
69073,69073.png,1,,vilifies the muslims by suggesting that they publicly cane their women.
69074,69074.png,1,,insults the muslims by suggesting that they have sex with goats.
69085,69085.png,1,,incites violence against the females by suggesting that they should be attacked by violent dogs.
69125,69125.png,1,,insults the blacks by suggesting that they are criminals who get arrested by the police.
69134,69134.png,1,,uses derogatory terms against the whites by referring to them as white trash whores.
69140,69140.png,1,,"insults the immigrants by suggesting that they are freeloaders who want free food, healthcare and housing."
69178,69178.png,1,,insults the jews by trivialising the gassing of the jews in world war 2 as an accident.
69205,69205.png,1,,insults the muslims by suggesting that they have sex with goats.
69234,69234.png,1,,insults the jews by making fun of the systematic killing of the jews in world war 2 by hitler.
69307,69307.png,1,,insults the females by referring to them as animals.
69327,69327.png,1,,incites violence against the muslims by suggesting that they should be shot.
69342,69342.png,1,,insults the mexicans by suggesting that they are uncivilized by calling them monkeys.
69351,69351.png,1,,insults the muslims by asking them to eat pigs.
69380,69380.png,1,,objectify the blacks by referring to them as farm equipment.
69402,69402.png,1,,insults the jews by making fun of the systematic killing of the jews in world war 2.
69405,69405.png,1,,insults the catholic christians by suggesting that they are rapists.
69428,69428.png,1,,insults the muslims by suggesting that they have sex with goats.
69450,69450.png,1,,insults the muslims by suggesting that they have sex with goats.
69472,69472.png,1,,insults the blacks by suggesting that they are all the same.
69518,69518.png,1,,insults the blacks by suggesting that they should be slaves who work to pick cotton in the cotton fields.
69520,69520.png,1,,uses derogatory terms against the russians.
69582,69582.png,1,,ridicules the mexicans by suggesting that they are thieves who will steal green cards to become american residents.
69728,69728.png,1,,insults the japanese by making fun of the atomic bombing of japan in world war 2.
69732,69732.png,1,,insults the hispanics and latinos by suggesting that they are disgusting by calling them roaches.
69751,69751.png,1,,vilifies the blacks by suggesting that are dangerous.
69804,69804.png,1,,insults the american indians by suggesting that they are uncivilized by calling them savage.
69807,69807.png,1,,insults the africans by making fun of the spread of aids in africa.
69813,69813.png,1,,ridicules the americans for the occurances of shooting in schools.
70123,70123.png,1,,uses derogatory terms against the lgbt community to refer to transgender people as trannies.
70126,70126.png,1,,uses derogatory terms against the lgbt community by referring to transgender people are trannies.
70132,70132.png,1,,vilifies the muslims by suggesting that they are terrorists that will blow people up if they don't think that muslims are peaceful.
70169,70169.png,1,,incites violence against the females by suggesting that they should be beat.
70183,70183.png,1,,uses derogatory terms against the blacks by calling them niggers.
70189,70189.png,1,,insults the jews by making fun of the systematic killing of the jews in world war 2.
70194,70194.png,1,,insults the jews by suggesting that they are thieves.
70196,70196.png,1,,insults the people with intellectual disabilities by mocking them by calling them potatoes.
70243,70243.png,1,,insults the muslims by mocking them for the christchurch shootings that occured on march 15th 2019.
70264,70264.png,1,,ridicules the people with physical disabilities by mocking michael j fox for having parkinson's disease.
70281,70281.png,1,,uses derogatory terms against the americans by calling them stupid.
70319,70319.png,1,,vilifies the muslims by suggesting that they are terrorists who kill others.
70324,70324.png,1,,vilifies the muslims by suggesting that they wish to kill homosexual people.
70329,70329.png,1,,insults the blacks by suggesting that they are prostitutes who will have sex for $20.
70352,70352.png,1,,insults the blacks by suggesting that they have many issues in their families.
70356,70356.png,1,,ridicules the lgbt community by mocking caitlyn jenner for being transgender by misidentifying a dog as a cat.
70368,70368.png,1,,"insults the muslims by suggesting that they have sex with goats, boys and donkeys."
70395,70395.png,1,,uses derogatory terms against the blacks by referring to them as niggers.
70426,70426.png,1,,insults the blacks by suggesting that they are slaves with chains around their legs.
70429,70429.png,1,,insults the males by suggesting that they should be hated.
70432,70432.png,1,,insults the jews by making fun of the systematic killing of the jews in world war 2.
70435,70435.png,1,,insults the jews by making fun of the systematic killing of the jews in world war 2.
70465,70465.png,1,,uses derogatory terms against the blacks by referring to them as niggers.
70492,70492.png,1,,mocks the americans for the school shooting that took place at sandy hook elementary school.
70512,70512.png,1,,insults the immigrants by objectifying them to be objects to be transported via bulldozer.
70531,70531.png,1,,insults the jews by making fun of the systematic killing of the jews by hitler in world war 2.
70534,70534.png,1,,insults the whites by suggesting that they should be eradicated.
70561,70561.png,1,,uses derogatory terms against the muslims to call them bastards.
70582,70582.png,1,,insults the blacks by suggesting they look ugly and disgusting by calling them a hemorrhoid.
70592,70592.png,1,,uses derogatory terms against the lgbt community by calling kyle jenner a tranny.
70598,70598.png,1,,insults the muslims by suggesting that they eat ass and dicks.
70612,70612.png,1,,uses derogatory terms against the blacks by using the term niggers.
70649,70649.png,1,,insults the people with physical disabilities by mocking those who need wheelchairs to move around by referring to them as vegetables.
70654,70654.png,1,,vilifies the muslims by suggesting muslim refugees will enslave others.
70826,70826.png,1,,incites violence against the muslims by suggesting that they should be bombs.
70835,70835.png,1,,insults the blacks by suggesting that they are less than human by calling them pets.
70845,70845.png,1,,insults the blacks by condoning slavery of the black people.
70849,70849.png,1,,insults the muslims by suggesting that muslim women should not be allowed to wear burqas in schools.
70851,70851.png,1,,uses derogatory terms against the lgbt community by referring to transgende r people as trannies.
70864,70864.png,1,,insults the blacks by suggesting that they are primitive by calling them monkeys.
70914,70914.png,1,,insults the jews by making fun of the numbers tattooed onto them in the concentration camps by nazi germany in world war 2.
70925,70925.png,1,,mocks the americans by making fun of the victims of the boston marathon bombings for being blown up.
70932,70932.png,1,,objectify the females by referring to them as dishwashers.
70934,70934.png,1,,insults the lgbt community by suggesting that they are childish and immature.
70942,70942.png,1,,uses derogatory terms against the lgbt community by referring to lesbians as bitches.
70948,70948.png,1,,insults the blacks by suggesting that they are willing to throw white babies off mountains.
71038,71038.png,1,,insults the jews by making fun of the systematic killing of the jews in world war 2 by hitler.
71042,71042.png,1,,insults the lgbt community by suggesting that gay people are disgusting.
71046,71046.png,1,,mocks the africans by suggesting that they are too poor to afford food to eat.
71052,71052.png,1,,insults the people with intellectual disabilities by mocking them for having difficulty in making good decisions.
71058,71058.png,1,,insults the blacks by suggesting that they are thieves.
71089,71089.png,1,,insults the people with intellectual disabilities by mocking people with autism for their difficulty in communication.
71095,71095.png,1,,vilifies the muslims by suggesting that they stone and behead muslim women.
71236,71236.png,1,,insults the jews by suggesting that the systematic killing of the jews by hitler was justified.
71263,71263.png,1,,insults the blacks by trivializing the slavery of black people in the united states by suggesting it never happened.
71280,71280.png,1,,insults the blacks by suggesting that only black people commit crimes and condoning racism.
71285,71285.png,1,,uses derogatory terms against the muslims by saying fuck islam and shit on mohammed and koran.
71294,71294.png,1,,mocks the blacks for making up a large portion of crime in the united states.
71320,71320.png,1,,insults the jews by making fun of the gassing of the jews in world war 2 by hitler.
71364,71364.png,1,,insults the blacks by likening dark-skin as monkeys and obama voters are monkeys.
71380,71380.png,1,,insults the refugees by suggesting that they should be drowned in the ocean.
71392,71392.png,1,,insults the males by suggesting that they are less intelligent by saying that they are like dogs.
71396,71396.png,1,,uses derogatory terms against the blacks by referring to them as nibbers.
71429,71429.png,1,,uses derogatory terms against the mexicans by calling them fuckers.
71430,71430.png,1,,insults the people with physical disabilities by mocking people who have seizures and comparing them to salt shakers.
71450,71450.png,1,,insults the muslims by suggesting that they are disgusting.
71459,71459.png,1,,insults the people with physical disabilities by mocking people with dwarfism by suggesting that they are partial.
71480,71480.png,1,,insults the blacks by suggesting that it is better to be blind than to be black.
71502,71502.png,1,,insults the people of color by implying that they are not pretty because they're not white.
71509,71509.png,1,,disrespects the females by insinuating that they are into beastiality.
71530,71530.png,1,,disrespects the jews by downplaying the culling of the jews by hitler through a joke about the holocaust making hitler sad.
71625,71625.png,1,,mocks the muslims for their practice of marrying children and suggesting that the children are stolen from europe.
71659,71659.png,1,,mocks the blacks for vandalising walls with spray paint.
71689,71689.png,1,,disrespects the lgbt community through the use of the derogatory term tranny against them.
71826,71826.png,1,,mocks the whites for the school shootings caused primarily by them.
71846,71846.png,1,,disrespects the jews by expressing hate against them and suggesting that they are an extremists group.
71863,71863.png,1,,disrespects the muslims by insinuating that they are into beastiality.
71869,71869.png,1,,disparages the jews by suggesting them to be misers.
71902,71902.png,1,,disrespects the lgbt community through the use of the derogatory term tranny against them.
71920,71920.png,1,,mocks the whites for police brutality against the blacks.
71942,71942.png,1,,mocks the africans for being underweight owing to the rampant poverty there.
71954,71954.png,1,,disrespects the muslims by suggesting them to be terrorists and suicide bombers.
71963,71963.png,1,,disparages the immigrants by suggesting that majority of them do not contribute to society after entering usa.
72014,72014.png,1,,disrespects the muslims through a joke about identifying as a firework rather than a suicide bomber.
72018,72018.png,1,,dehumanizes the females by likening them to a car and suggesting that both will cause problems.
72084,72084.png,1,,disparages the blacks by suggesting that they are prone to gun violence.
72094,72094.png,1,,disrespects the jews by trivialising the culling of the jews by hitler through a joke about hitler telling his mother he killed a man.
72318,72318.png,1,,disparages the blacks by suggesting that they are criminals and only stop being one when they are dead.
72340,72340.png,1,,disrespects the muslims by implying that they are terrorists who will attack any time.
72345,72345.png,1,,disparages the blacks through the use of the kkk which is a white supremacist group.
72361,72361.png,1,,disrespects the jews by downplaying the culling of jews by suggesting that pornography can be found in holocaust documentaries.
72386,72386.png,1,,disrespects the muslims by suggesting that they are into beastiality.
72396,72396.png,1,,disrespects the lgbt community by expressing hate against the queers.
72456,72456.png,1,,disrespects the whites by calling them dumb and likening them to untrained dogs.
72459,72459.png,1,,disrespects the muslims by suggesting that they are terrorists who kill civilians with guns.
72489,72489.png,1,,disparages the lgbt community by suggesting that the members are mentally ill.
72509,72509.png,1,,disrespects the lgbt community by suggesting that their sexual orientation is caused by ingesting chemicals.
72531,72531.png,1,,dehumanizes the indians by suggesting that they were primates before independence day.
72561,72561.png,1,,disrespects the lgbt community through the use of the derogatory term tranny and joking about how the term used was used to refer to a car transmission in the past.
72594,72594.png,1,,disrespects the lgbt community by expressing animosity against trangender people.
72604,72604.png,1,,mocks the males for being insensitive towards the feelings of females by likening them to dogs.
72654,72654.png,1,,disrespects the muslims by suggesting that their presence in usa is unwelcomed.
72698,72698.png,1,,mocks the canadians for wasting tax dollars to purchase pipelines only for it to not be built.
72814,72814.png,1,,disrespects the africans by likening them to monkeys.
72834,72834.png,1,,disrespects the muslims by suggesting that they are killers.
72893,72893.png,1,,mocks the muslims for preaching islam to be a religion of peace when they will kill you if you do not believe in their belief.
72910,72910.png,1,,mocks the christians for their anti-lgbt beliefs.
72940,72940.png,1,,disrespects the males by suggesting that male feminists are lesser people who are not normal.
72946,72946.png,1,,dehumanizes the blacks by implying that they are property that can be owned.
72956,72956.png,1,,dehumanizes the females by suggesting that they are lesser people who are only good for cooking and household chores.
72984,72984.png,1,,disrespects the blacks through the use of the derogatory term nigger.
73028,73028.png,1,,disrespects the lgbt community through the use of the derogatory term tranny against them and suggesting gays like transgender people.
73059,73059.png,1,,disrespects the muslims by suggesting that they are terrorists as proven in past events.
73082,73082.png,1,,disrespects the saudi arabians by suggesting that they fund terrorism and should be annihilated.
73091,73091.png,1,,mocks the muslims for their practice of child marriages.
73128,73128.png,1,,disrespects the lgbt community by suggesting their gender to be a mental illness which should not be tolerated.
73152,73152.png,1,,dehumanizes the females by implying that they are lesser people who are only good for cooking.
73160,73160.png,1,,disrespects the muslims by suggesting that they are terrorists.
73162,73162.png,1,,mocks the whites for police brutality against the blacks and getting away with it.
73164,73164.png,1,,disrespects the females by suggesting that they are a man's outlet for violence.
73168,73168.png,1,,mocks the christians for the irony of promoting respect for the blacks when they are known for hanging them.
73204,73204.png,1,,mocks the muslims for having a place in congress when they have caused terrorists attacks in the past.
73256,73256.png,1,,disrespects the blacks by suggesting them to be a combination of a gorilla and rhino.
73406,73406.png,1,,disparages the mexicans by suggesting them to be rapists.
73426,73426.png,1,,disrespects the israelis by highlighting their history of being enslaved.
73480,73480.png,1,,disrespects the people with intellectual disabilities by suggesting them to be slow.
73498,73498.png,1,,disparages the mexicans by implying that they are lesser people who should be incarcerated if they were to make a mistake in a food order.
73516,73516.png,1,,mocks the jews for genocide against the palestinians despite being a group who experienced genocide in the past.
73518,73518.png,1,,disrespects the americans by likening them to pigs.
73520,73520.png,1,,disrespects the muslims by suggesting that they are suicide bombers through a joke about their religious garment being used to hide bombs.
73561,73561.png,1,,disparages the muslims by suggesting them to be terrorists who are all represented by osama bin laden.
73568,73568.png,1,,disrespects the lgbt community by joking about their sexuality.
73581,73581.png,1,,disrespects the blacks through the use of the derogatory term nigger.
73609,73609.png,1,,mocks the africans for their lack of water and joking about how pulling out a bottle of water will cause them to gather around you in hopes of receiving it.
73619,73619.png,1,,mocks the africans by joking about them mistaking cotton candy for cotton and attempting to pick it as part of labour.
73806,73806.png,1,,mocks the people with intellectual disabilities by downplaying their disability and deeming it as a problem.
73910,73910.png,1,,mocks the people with physical disabilities by joking about not having to shave their genitalia owing to hair loss from chemotherapy.
73956,73956.png,1,,disparages the christians by suggesting that they are retarded through an image of two women joking about it.
73984,73984.png,1,,mocks the females for being pro-women rather than fighting for gender equality.
74021,74021.png,1,,mocks the christians for their poor driving skills.
74053,74053.png,1,,disparages the whites by likening them to trash.
74061,74061.png,1,,disrespects the jews by celebrating the culling of the jews during the holocaust when one finds out about their german ancestry.
74062,74062.png,1,,disrespects the lgbt community by suggesting that being trangender is a mental illness and a form of escapism which can take a toll on one's mental health.
74098,74098.png,1,,disrespects the jews by downplaying the culling of the jews during the holocaust by suggesting their faces then to be similar to that of a shocked cat.
74132,74132.png,1,,disrespects the muslims by expressing animosity against them.
74150,74150.png,1,,disrespects the whites by likening them to trash.
74198,74198.png,1,,dehumanizes the blacks by implying them to be lesser people who do not deserve to ride on a bus.
74203,74203.png,1,,disrespects the lgbt community by likening the trangender to a car transmission.
74215,74215.png,1,,mocks the people with physical disabilities for not having hands and joking about them being unable to do handjobs.
74218,74218.png,1,,disrespects the lgbt community by suggesting that transgender women are lesser than actual women and not worth touching.
74268,74268.png,1,,disrespects the mexicans by expressing hate against them through a child in pain and blaming the mexicans.
74356,74356.png,1,,disrespects the muslims by insinuating that they are into beastiality.
74361,74361.png,1,,disrespects the people with intellectual disabilities by joking about them mistaking the school bell for the start of the hunger games.
74386,74386.png,1,,disrespects the muslims by suggesting that they are all terrorists through the use of the fallen world trade center.
74390,74390.png,1,,disparages the jews by suggesting them to be racist monsters.
74513,74513.png,1,,mocks the people with physical disabilities for their inability to run.
74520,74520.png,1,,disrespects the pakistanis by incorporating pork into their country name when many of the people there do not eat pork.
74530,74530.png,1,,disrespects the jews by downplaying the culling of jews during the holocaust through a joke about them screaming in an oven.
74536,74536.png,1,,disrespects the people with intellectual disabilities by suggesting that they are slow.
74562,74562.png,1,,disrespects the whites through the use of the derogatory term honky and suggesting them to be aggressive.
74583,74583.png,1,,dehumanizes the jews by suggesting that they are not human and justifying their culling by hitler.
74608,74608.png,1,,disrespects the lgbt community by labelling them as fake and expressing hate against them through the derogatory term tranny.
74609,74609.png,1,,disrespects the muslims by suggesting that they are savages who ruin a country after immigration.
74625,74625.png,1,,disparages the muslims by insinuating that they are into beastiality.
74630,74630.png,1,,disrespects the muslims by suggesting that they are in politics to destroy israel and the american way of life.
74652,74652.png,1,,mocks the people with intellectual disabilities by joking about their poor mathematics skills.
74801,74801.png,1,,disparages the lgbt community by suggesting that their gender is a lifestyle choice and expressing hate against their choice.
74802,74802.png,1,,disparages the lgbt community by suggesting that they have aids and spread to to others through anal sex.
74805,74805.png,1,,disrespects the jews by suggesting them to be misers.
74862,74862.png,1,,dehumanizes the females by implying that they are lesser people who are only good for washing dishes.
74890,74890.png,1,,dehumanizes the females by implying them to be lesser people who are only good for washing dishes.
74968,74968.png,1,,disparages the blacks by suggesting that black men are irrespnsible people who abandon their family after child birth.
75021,75021.png,1,,disparages the immigrants by suggesting that they should be attacked by a sharked when seeking asylum on a boat.
75023,75023.png,1,,disparages the blacks by likening them to tires as they have similar colours.
75046,75046.png,1,,disrespects the blacks by likening them to gorillas and suggesting that their head size corresponds to their intellect.
75082,75082.png,1,,disrespects the blacks by suggesting that they should die.
75086,75086.png,1,,dehumanizes the females by implying that they are lesser people who are only good for cooking.
75092,75092.png,1,,disrespects the lgbt community by suggesting that a trangender women who is lesbian is the same as being a guy.
75096,75096.png,1,,ridicules the people with intellectual disabilities as retarded.
75098,75098.png,1,,ridicules the people with intellectual disabilities as vegetables.
75130,75130.png,1,,derides the lgbt community by deliberately segregating transgender as a standalone battalion.
75139,75139.png,1,,disrespects the jews by trivializing the killing of jews in gas chambers during the holocaust.
75209,75209.png,1,,dehumanizes the blacks as monkeys.
75231,75231.png,1,,dehumanizes the blacks as monkeys.
75239,75239.png,1,,incites violence against the females by suggesting that one can engage in non-consensual sex with a female by using chloroform to make her unconscious.
75290,75290.png,1,,ridicules the africans by mocking the fact that africa has child soldiers.
75291,75291.png,1,,dehumanizes the muslims as murderers by suggesting that they keep killing people and the government still keep bringing these murderers into the country.
75294,75294.png,1,,ridicules the lgbt community by mocking the sexual preference of homosexual males.
75308,75308.png,1,,ridicules the lgbt community by questioning their ability to have children.
75321,75321.png,1,,ridicules the indonesians by suggesting that the indonesian tribes are cannibalistic.
75340,75340.png,1,,ridicules the muslims as degenerates by joking that the muslims are allowed to behead their enemies and marry young girls but aren't allowed to eat sandwiches with pork in them.
75349,75349.png,1,,disrespects the jews by trivializing the hitler's killing of jews in gas chambers during the holocaust.
75360,75360.png,1,,ridicules the people with physical disabilities as vegetables.
75380,75380.png,1,,ridicules the christians by suggesting that the christians make generalizations about people.
75381,75381.png,1,,ridicules the whites as terrorists by mocking the large number of school shootings that happen in the us.
75382,75382.png,1,,"ridicules the muslims as inferior by suggesting that the muslim, ilhan omar, has crap for brains and so she should wear a diaper on her head because of it."
75402,75402.png,1,,incites violence against the jews by suggesting that calling for all jews to be burned alive is acceptable behaviour.
75410,75410.png,1,,ridicules the blacks as thieves by joking that the blacks stole the word 'nigger' from the whites.
75421,75421.png,1,,incites violence against the lgbt community by suggesting that lynching transgenders is acceptable behaviour.
75428,75428.png,1,,ridicules the blacks as oversensitive by suggesting that they will shoot someone who makes offensive signs at them.
