id,image_path,label,text,reason
50491,50491.png,1,,derides the blacks by suggesting that they are effeminate and they wear panties.
50679,50679.png,1,,ridicules the blacks as inferior by suggesting that a black baby is a new pet for a young white girl.
50689,50689.png,1,,disrespects the blacks by mocking them for being the top victim of police shootings while the whites can get away with shooting children in schools.
50732,50732.png,1,,ridicules the muslims as hypocrites by suggesting that they kill atheists in their own countries and then want islam to be known as a religion of peace in countries where they are a minority.
50738,50738.png,1,,ridicules the whites as killers.
50739,50739.png,1,,disrespects the jews by trivializing the internment and killing of jews in concentration camps during the holocaust.
50743,50743.png,1,,disrespects the jews by trivializing hitler's gassing of jews in gas chambers during the holocaust.
50746,50746.png,1,,ridicules the africans by mocking the fly-covered bodies of the starving children in africa.
50748,50748.png,1,,ridicules the lgbt community by mocking those who cross-dress.
50764,50764.png,1,,ridicules the blacks as beggars.
50789,50789.png,1,,incites violence against the immigrants.
50817,50817.png,1,,ridicules the lgbt community as attention-seeking by suggesting that homosexuals change to being transgenders to get more attention.
50834,50834.png,1,,ridicules the whites as evil by suggesting that white men are evil.
50867,50867.png,1,,ridicules the people with intellectual disabilities as retarded.
50873,50873.png,1,,derides the lgbt community by using wordplay to mock caitlyn jenner for being a transgender.
50876,50876.png,1,,ridicules the females by suggesting they are retarded male homosexuals wearing womens' suits.
50879,50879.png,1,,dehumanizes the females as less capable humans that are not good for anything except housekeeping chores such as dishwashing.
50894,50894.png,1,,disrespects the blacks by joking about using cotton-balls as flowers for martin luther king day to remind the blacks about their enslavement during colonial times.
50934,50934.png,1,,ridicules the females by mocking fat females.
51023,51023.png,1,,ridicules the muslims as incestuous by suggesting that muslim males engage in sexual intercourse with their sisters.
51086,51086.png,1,,ridicules the europeans by mocking europeans who have red hair.
51089,51089.png,1,,ridicules the people with intellectual disabilities by likening them to fruits and vegetables.
51348,51348.png,1,,ridicules the immigrants as criminals.
51367,51367.png,1,,ridicules the females as inferior by suggesting that they cannot drive and that they kill people if they try to drive.
51387,51387.png,1,,"ridicules the asians as stupid by suggesting that they will hold their phone to their ear if someone says 'wing, wing, wing."
51403,51403.png,1,,disrespects the jews by trivializing hitler's gassing of jews in gas chambers during the holocaust.
51407,51407.png,1,,uses derogatory terms against the blacks.
51462,51462.png,1,,ridicules the muslims as murderers by suggesting that they kill as many people as they want.
51473,51473.png,1,,disrespects the jews by trivializing hitler's killing of jews in concentration camps during the holocaust.
51476,51476.png,1,,ridicules the blacks by mocking thee fact that they are the most common victims of police shootings.
51489,51489.png,1,,ridicules the chinese as savages by suggesting that they eat dogs.
51493,51493.png,1,,dehumanizes the blacks as inferior humans that are only good for working on the farm.
51497,51497.png,1,,ridicules the muslims as terrorists by suggesting that they carry bombs in their backpacks.
51629,51629.png,1,,ridicules the muslims as degenerates by suggesting that muslim males engage in sexual intercourse with goats.
51647,51647.png,1,,"ridicules the muslims by suggesting that muslim homosexuals are beheaded, so the men cover themselves up to appear like a woman."
51679,51679.png,1,,ridicules the afghans as terrorists by suggesting that the afghans join a terrorist group like the taliban when their girlfriends break up with them.
51682,51682.png,1,,"ridicules the muslims as inferior by suggesting that the muslim, ilhan omar, has crap for brains and so she should wear a diaper on her head because of it."
51683,51683.png,1,,ridicules the blacks by joking about the colour of their skin.
51694,51694.png,1,,ridicules the females as fat by joking that overweight females could destroy patriarchy if they ate it.
51706,51706.png,1,,ridicules the blacks as thieves by suggesting that they will steal from people and then pretend to help look for what they stole.
51726,51726.png,1,,"ridicules the blacks as slaves by suggesting that they can be traded, similar to the process of winning an opponents car in a street race."
51734,51734.png,1,,disrespects the blacks by mocking them for being the top victim of police shootings while the whites can get away with shooting children in schools.
51736,51736.png,1,,disrespects the jews by suggesting that america's black slaves are the true hebrews and not the jews.
51763,51763.png,1,,ridicules the lgbt community as unwelcome by telling them to be gay somewhere also.
51802,51802.png,1,,ridicules the chinese as savages by suggesting that they eat cats.
51804,51804.png,1,,disrespects the jews by using wordplay on the word 'and' to trivialize the internment and killing of jews in concentration camps during the holocaust.
51836,51836.png,1,,incites violence against the blacks by suggesting that black females need a beating.
51894,51894.png,1,,ridicules the muslims as terrorists by suggesting that they put bombs on buses and rape children.
51903,51903.png,1,,ridicules the whites as incestuous by suggesting that the whites engage in sexual intercourse with their cousins.
51964,51964.png,1,,ridicules the asians by stereotyping them to be technical support workers who consume large amounts of rice.
52018,52018.png,1,,ridicules the muslims as radicalized refugees by suggesting that they come from terrorist countries and attack people on the street in the name of religion.
52036,52036.png,1,,ridicules the muslims as primitive by likening them to chewbaccas.
52049,52049.png,1,,disrespects the muslims by referring to the 49 muslims that died in the christchurch mosque shootings as rags.
52097,52097.png,1,,derides the whites as trash vapers.
52183,52183.png,1,,disrespects the jews by making a joke out of anne frank and hitler.
52316,52316.png,1,,mocks the lgbt community by making fun of transgenders.
52379,52379.png,1,,dehumanizes the blacks as lesser humans better suited for farming.
52386,52386.png,1,,mocks the blacks by suggesting that their women are two-faced when it comes to how they treat men from different races.
52406,52406.png,1,,derides the whites as trash if they voted for trump and shop at walmart.
52439,52439.png,1,,disrespects the japanese by joking about the two nuclear strikes on japan during wwii.
52469,52469.png,1,,disrespects the jews by mocking them for burning alive in an oven.
52479,52479.png,1,,mocks the africans for being so starved they will even swallow semen.
52483,52483.png,1,,derides the indians as serial rapists.
52486,52486.png,1,,derides the whites as drug addicts.
52490,52490.png,1,,derides the immigrants as unwanted and criminal trespassers.
52607,52607.png,1,,incites violence against the immigrants by suggesting it is cool to shoot immigrants.
52610,52610.png,1,,dehumanizes the blacks as monkeys.
52613,52613.png,1,,mocks the people with intellectual disabilities by calling them smashed potatoes.
52619,52619.png,1,,derides the whites as the devil.
52631,52631.png,1,,derides the israelis by labelling their country as hell.
52640,52640.png,1,,mocks the females for being fat.
52649,52649.png,1,,mocks the muslims by suggesting the are pedophiles that marry babies as wives.
52681,52681.png,1,,derides the whites as white trash.
52708,52708.png,1,,mocks the lgbt community for their transitioning.
52714,52714.png,1,,derides the muslims as terrorists that make bombs in school.
52743,52743.png,1,,mocks the lgbt community by associating transgender males as girl with a penis.
52761,52761.png,1,,dehumanizes the females as lesser humans that should serve their partners and not talk back.
52790,52790.png,1,,mocks the females for drinking arizona iced tea and becoming obese.
52801,52801.png,1,,mocks the people with physical disabilities as vegetables.
52803,52803.png,1,,mocks the people with intellectual disabilities for their stress triggers.
52819,52819.png,1,,mocks the lgbt community by making fun of their gender identities.
52837,52837.png,1,,mocks the jews by trivializing hitler's use of chemical agents on the polish jews during the holocaust.
52867,52867.png,1,,mocks the lgbt community by asking people to be careful of transgender women.
52903,52903.png,1,,incites violence against the lgbt community by threatening to throw gays off bridges.
52918,52918.png,1,,dehumanizes the females as sex objects even children.
52947,52947.png,1,,dehumanizes the blacks as lesser humans comparable to monkeys.
52974,52974.png,1,,disrespects the jews by comparing them to ashes in reference to their mass cremation during wwii.
52983,52983.png,1,,derides the muslims as terrorists that want to bomb churches.
52986,52986.png,1,,mocks the blacks as monkeys.
53062,53062.png,1,,derides the muslims as the cause for islamophobia themselves.
53140,53140.png,1,,mocks the americans by downplaying the 9/11 attacks.
53184,53184.png,1,,mocks the lgbt community as something that didnt exist back in the day.
53194,53194.png,1,,mocks the blacks for being fathers that do not raise their kids.
53268,53268.png,1,,derides the immigrants as killers and smugglers that go unchecked.
53270,53270.png,1,,incites violence against the jews by asking for the extermination of jews.
53420,53420.png,1,,mocks the blacks for being arrested by police just for being black.
53469,53469.png,1,,derides the jews as the real culprits behind 9/11.
53481,53481.png,1,,derides the muslims as bombs and comparing a group of muslims to minesweeper.
53482,53482.png,1,,mocks the asians for their accent when speaking english.
53486,53486.png,1,,mocks the muslims by suggesting that they explode when they orgasm.
53492,53492.png,1,,derides the chinese by suggesting their opinions should be disregarded.
53607,53607.png,1,,mocks the muslims as goat humpers.
53618,53618.png,1,,derides the lgbt community by labelling them as repulsive.
53678,53678.png,1,,disrespects the jews by comparing them to ashes in reference to their mass cremation during wwii.
53692,53692.png,1,,mocks the muslims by suggesting they engage in bestiality with goats.
53694,53694.png,1,,derides the muslims as crazy killers that are being supported by democrats and liberals.
53740,53740.png,1,,uses derogatory terms against the blacks to say that they are not beautiful.
53782,53782.png,1,,incites violence towards the israelis by threatening to shoot them.
53806,53806.png,1,,uses derogatory terms against the people with physical disabilities.
53812,53812.png,1,,incites violence against the muslims by threatening to kill islam with extreme prejudice.
53876,53876.png,1,,derides the muslims as a danger that should be banned except for the rich ones.
53879,53879.png,1,,incites violence against the muslims by asking for them to be sniped.
53904,53904.png,1,,incites violence against the muslims by threatening to shoot them.
53927,53927.png,1,,derides the muslims as arsonists and hence one need to be prepared to firefight when visiting their houses.
53941,53941.png,1,,derides the whites as racists.
53948,53948.png,1,,derides the jews as the terrorists behind the 9/11 attacks.
53980,53980.png,1,,disrespects the lgbt community by suggesting they have something wrong with their heads.
54023,54023.png,1,,mocks the lgbt community as trash that only get their time from companies during pride month.
54028,54028.png,1,,mocks the muslims for killing gays when they dress like gay men.
54039,54039.png,1,,derides the indians as mostly idiots.
54102,54102.png,1,,dehumanizes the females as the lesser gender that should not be given a choice.
54179,54179.png,1,,derides the muslims as child rapists.
54270,54270.png,1,,dehumanizes the females as less capable humans that are better suited to chores like dishwashing.
54301,54301.png,1,,derides the whites and asking them to go fuck themselves.
54389,54389.png,1,,dehumanizes the females as animals that should be spayed or neutered.
54602,54602.png,1,,mocks the blacks for getting shot and killed by police.
54608,54608.png,1,,derides the jews as the true masterminds behind muslim terrorists.
54610,54610.png,1,,mocks the christians for hating gays by making a pun that jesus rode an ass.
54632,54632.png,1,,mocks the females as bad drivers that will lower the accident rates if they were not allowed to drive.
54670,54670.png,1,,mocks the whites for engaging in bestiality with horses.
54672,54672.png,1,,mocks the chinese by suggesting they cook dogs.
54682,54682.png,1,,derides the muslims as terrorists and hence should not be cared about.
54690,54690.png,1,,disrespects the jews by mocking the jews that disappeared to the concentration camps only to never return again.
54697,54697.png,1,,mocks the jews by portraying hitler as a safe haven for jews.
54719,54719.png,1,,mocks the muslims for being attracted to goats.
54789,54789.png,1,,mocks the people with intellectual disabilities by referring to them as special forces.
54793,54793.png,1,,mocks the indians for shitting on the streets like dogs.
54837,54837.png,1,,disrespects the lgbt community by using them as derogatory terms.
54891,54891.png,1,,mocks the whites as stupid for not being able to understand a hospital sign correctly.
54927,54927.png,1,,derides the muslims as pedophiles that marry children as wives.
54978,54978.png,1,,disrespects the blacks by suggesting that the whites have been secretly calling them racial slurs.
54981,54981.png,1,,derides the muslims as killers that the government keeps bringing in.
56048,56048.png,1,,derides the muslims as rocket wielding terrorists.
56071,56071.png,1,,mocks the muslims by suggesting their men fist each other anally.
56091,56091.png,1,,mocks the muslims as having goats for wives.
56108,56108.png,1,,dehumanizes the blacks as monkeys.
56128,56128.png,1,,mocks the jews by comparing them to spongebob and patrick.
56138,56138.png,1,,derides the muslims as terrorists.
56183,56183.png,1,,disrespects the lgbt community by making fun of their gender.
56193,56193.png,1,,mocks the romanians for being impaled in the past by vlad the impaler.
56248,56248.png,1,,disrespects the muslims by calling their prophet a pig fucker.
56304,56304.png,1,,mocks the blacks for being victims of police brutality.
56340,56340.png,1,,incites violence against the jews by asking for them to be put back into concentration camps.
56374,56374.png,1,,uses derogatory terms against the blacks.
56378,56378.png,1,,derides the blacks as criminals.
56389,56389.png,1,,mocks the people with intellectual disabilities by making fun of their dyslexia.
56417,56417.png,1,,incites hate towards the christians.
56421,56421.png,1,,dehumanizes the lgbt community as sex objects.
56470,56470.png,1,,derides the people of color as unwanted and should not be in america.
56482,56482.png,1,,mocks the whites for being destroyed by heroin.
56490,56490.png,1,,mocks the lgbt community by referring to them as rectal wart sex.
56712,56712.png,1,,mocks the blacks by naming them as kfc and grape soda.
56719,56719.png,1,,derides the muslims as terrorists that will blow people up for disagreeing with them.
56721,56721.png,1,,dehumanizes the lgbt community as sex objects.
56819,56819.png,1,,mocks the jews by joking about the trains that were used to deport the jews to concentration camps.
56830,56830.png,1,,disrespects the blacks by joking about michael brown that died after being shot by police.
56834,56834.png,1,,derides the muslims as killers of gay men.
56843,56843.png,1,,disrespects the blacks by downplaying the past when they were kept as slaves for farming.
56871,56871.png,1,,derides the mexicans as illegal immigrants whose opinions should be disregarded.
56891,56891.png,1,,derides the blacks as thieves.
56907,56907.png,1,,dehumanizes the females as less capable humans suited for household chores like doing laundry.
56910,56910.png,1,,uses derogatory terms against the blacks and bringing up their history of being traded as slaves.
56930,56930.png,1,,mocks the jews by making fun of their plight in the gas chambers during the holocaust.
56974,56974.png,1,,mocks the blacks for having fathers that refuse to accept their children and abandon them.
57013,57013.png,1,,uses derogatory terms against the whites.
57042,57042.png,1,,incites violence against the blacks and asking for them to be killed otherwise they will take all the white women.
57064,57064.png,1,,mocks the lgbt community as mentally ill.
57093,57093.png,1,,dehumanizes the females as less capable humans suited for household chores like dishwashing.
57120,57120.png,1,,mocks the jews by suggesting that hitler would be forgiven by god even after he killed the millions of jews.
57124,57124.png,1,,mocks the jews as misers that are unwilling to split a bill evenly.
57134,57134.png,1,,disrespects the blacks by suggesting there was a just reason for them to be made slaves in the past.
57142,57142.png,1,,disrespects the jews by downplaying hitler's gassing of the jews.
57164,57164.png,1,,derides the blacks as rapists.
57189,57189.png,1,,derides the people with physical disabilities as a mistake.
57203,57203.png,1,,derides the muslims as killers of canadians.
57236,57236.png,1,,derides the muslims as people that beat their sisters.
57284,57284.png,1,,disrespects the jews by making fun of the holocaust.
57302,57302.png,1,,derides the blacks for having children with whites to preserve their species.
57348,57348.png,1,,disrespects the jews by downplaying the burning of jews during wwii as cooking in the oven.
57401,57401.png,1,,derides the lgbt community as people that will burn eternally in hell.
57412,57412.png,1,,mocks the people with physical disabilities by suggesting their movement aids can be used for go cart building.
57421,57421.png,1,,disrespects the jews by downplaying the holocaust.
57426,57426.png,1,,derides the muslims as bomb makers.
57430,57430.png,1,,derides the muslims as killers of white people.
57438,57438.png,1,,mocks the jews by joking about the story of anne frank.
57630,57630.png,1,,mocks the muslims by suggesting pigs as gifts for muslims that religiously abstain from them.
57631,57631.png,1,,dehumanizes the blacks as farm equipment.
57638,57638.png,1,,mocks the lgbt community as something that didnt exist back in the day.
57693,57693.png,1,,mocks the people with physical disabilities by suggesting they crawl on the beach.
57802,57802.png,1,,dehumanizes the people with physical disabilities as lesser humans that are missing parts.
57821,57821.png,1,,derides the jews as the enemy that burnt down notre dame to send a message to the world.
57826,57826.png,1,,mocks the lgbt community by making fun of the pride movement.
57831,57831.png,1,,mocks the muslims as goat rapists.
57840,57840.png,1,,mocks the lgbt community by calling transgender women fake women.
57861,57861.png,1,,derides the whites as redneck trash that are rude crude and crass.
57913,57913.png,1,,mocks the mexicans for extreme carpooling.
57918,57918.png,1,,derides the muslims as rapists thieves and killers that have no moral repercussions.
57962,57962.png,1,,mocks the lgbt community by labelling gays as fruits.
57968,57968.png,1,,mocks the muslims for wearing the burqa because they are so ugly.
57982,57982.png,1,,derides the muslims as killers that the government keeps bringing in.
58019,58019.png,1,,derides the muslims as all radicals that will kill if one does not follow their god.
58023,58023.png,1,,mocks the females for having drunk and abusive partners.
58061,58061.png,1,,mocks the lgbt community for their identities and calling them fat as well.
58091,58091.png,1,,derides the muslims as suicide bombers that do so to get closer to their god.
58124,58124.png,1,,derides the muslims by referring to the quran as a declaration of war.
58127,58127.png,1,,derides the muslims for hiding bombs as a pregnancy bump.
58136,58136.png,1,,derides the whites as the problem with america.
58164,58164.png,1,,mocks the lgbt community.
58170,58170.png,1,,mocks the whites for smelling like dogs.
58190,58190.png,1,,derides the muslims as either pedophiles or goat fuckers.
58196,58196.png,1,,mocks the jews by reminding them that their ancestors never escaped from the gas chambers.
58204,58204.png,1,,mocks the lgbt community by not recognising their gender identities.
58209,58209.png,1,,incites violence and hate against the females by suggesting that they get beaten up.
58246,58246.png,1,,derides the whites as xenophobic people that want the mexicans deported.
58247,58247.png,1,,mocks the people with physical disabilities for being unable to give handjobs.
58301,58301.png,1,,derides the muslims and asking for them to go back to arabia if they do not want their feelings to be hurt.
58312,58312.png,1,,ridicules the males as stupid.
58327,58327.png,1,,dehumanizes the females as less capable humans suited for household chores like mopping the floor.
58340,58340.png,1,,derides the blacks as a race that should be aborted.
58361,58361.png,1,,disrespects the lgbt community by stating that only two genders exist.
58367,58367.png,1,,derides the europeans as rapists pilagers and thieves of the native americans.
58421,58421.png,1,,uses derogatory terms against the blacks.
58490,58490.png,1,,derides the muslims as killers and having incestuous relationships.
58604,58604.png,1,,mocks the people with intellectual disabilities for having an extra chromosome.
58609,58609.png,1,,mocks the muslims by suggesting they engage in group sex with goats.
58612,58612.png,1,,derides the mexicans as unclean and uncivil.
58631,58631.png,1,,disrespects the lgbt community by mocking transgender woman and refusing to recognise their gender.
58649,58649.png,1,,uses derogatory terms against the lgbt community to mock them.
58706,58706.png,1,,disrespects the people with intellectual disabilities by making fun of down syndrome and suggesting that up syndrome is possible if you get high enough.
58740,58740.png,1,,incites violence against the muslims by referencing a crusade to liberate ourselves from muslims.
58743,58743.png,1,,derides the jews as a parasitic cancer unto the nations.
58764,58764.png,1,,mocks the people with physical disabilities for being unable to see the emojis made for them.
58904,58904.png,1,,derides the whites as racists that should be killed.
58906,58906.png,1,,derides the jews as hypocrites that play the role of victim while victimising everyone else.
59026,59026.png,1,,derides the jews as perverts and enemies of the people that caused many to go into bankruptcy.
59043,59043.png,1,,disrespects the blacks by suggesting that the whites have been secretly calling them racial slurs.
59124,59124.png,1,,mocks the jews by making a pun out of the concentration camps.
59128,59128.png,1,,mocks the muslims by comparing their religious headwear to a diaper for people that have shit for brains.
59142,59142.png,1,,mocks the lgbt community by suggesting that gays spread stds quickly.
59203,59203.png,1,,derides the muslims as terrorists behind the hit on the world trade center.
59237,59237.png,1,,mocks the people with intellectual disabilities by making a pun out of retard.
59238,59238.png,1,,mocks the blacks for either working at kfc or as pimps or being unemployed.
59260,59260.png,1,,disrespects the jews by calling pictures of the holocaust a child porn collection.
59316,59316.png,1,,dehumanizes the females as the lesser gender that should be beaten up by men.
59342,59342.png,1,,incites violence against the lgbt community by offering to shoot them all.
59370,59370.png,1,,incites violence against the females if they refuse to do household chores like dishwashing.
59376,59376.png,1,,mocks the muslims by comparing their religious headwear to a diaper for people that have shit for brains.
59402,59402.png,1,,disrespects the jews by making a pun out of the holocaust.
59408,59408.png,1,,derides the lgbt community as pedophiles who adopt and prey on young children.
59410,59410.png,1,,dehumanizes the blacks as lesser humans comparable to monkeys.
59436,59436.png,1,,mocks the jews by joking about the trains that were used to deport the jews to concentration camps.
59462,59462.png,1,,dehumanizes the blacks as lesser humans that can be kept as slaves.
59467,59467.png,1,,mocks the muslims by comparing their burka to a trashbag with slits for eyes.
59470,59470.png,1,,disrespects the muslims by mocking their abstinence of pork and making a pun with ham on their names.
59473,59473.png,1,,ridicules the indians by comparing the bindi to scratching off a lottery ticket.
59478,59478.png,1,,disrespects the jews by reminding them of how their grandparents died in the holocaust.
59487,59487.png,1,,derides the muslims as suicide bombers that are chosen from childhood.
59613,59613.png,1,,dehumanizes the lgbt community as sex objects.
59621,59621.png,1,,mocks the blacks for having no dads.
59623,59623.png,1,,mocks the females as irrational and delusional.
59714,59714.png,1,,derides the immigrants as rioters and looters.
59716,59716.png,1,,mocks the whites as school shooters.
59726,59726.png,1,,derides the muslims as people that are in cahoots with satan.
59731,59731.png,1,,disrespects the japanese by joking about the nuking of hiroshima which killed many japanese.
59732,59732.png,1,,derides the muslims for trying to change this country to have more restrictions against the females.
