id,image_path,misogynist,shaming,stereotype,objectification,violence,text
301,mami_301.png,1,0,1,1,0,Get back to the kitchen and make me a sandwich
302,mami_302.png,0,0,0,0,0,Female engineer leading the NASA spacecraft navigation team
303,mami_303.png,1,1,1,0,0,She gained 10 pounds and thinks she's still a model
304,mami_304.png,0,0,0,0,0,A woman voting during elections in the early 20th century
305,mami_305.png,1,0,0,1,0,Just another decoration for the office party
306,mami_306.png,1,0,0,0,1,"If she talks back, teach her a lesson"
307,mami_307.png,0,0,0,0,0,Mother reading a storybook to her children before bedtime
308,mami_308.png,1,1,0,1,0,"Dressed like that, she was begging for attention"
